{"$schema":"https://json-schema.org/draft/2020-12/schema","blindPacket":{"acceptedSemanticClassification":{"attentionDemand":"engaged","discoveryStyle":"adventurous","emotionalWeight":"light","filterLanguages":["Cantonese","Dutch","English"],"moods":["funny","exciting","suspenseful"],"pace":"fast","situations":["friends","family","easy-watch"]},"allowedSourceMaterial":{"keywords":[],"overview":"A group of covert CIA operatives trailing a potential new energy source are double-crossed by corrupt agent Morgan, who causes a helicopter crash in remote South Africa. The sole survivor, suffering severe amnesia, is nursed to recovery by a kindly native tribe who call him \"Whoami\" after the question he keeps asking. With the help of a mysterious reporter Christine, Whoami pieces together his past and tracks the turncoat agent and his criminal cohorts."},"candidateId":"scale500-tmdb-8697","copyConstraints":{"curiosityHook":{"maxChars":170,"minChars":50},"description":{"maxChars":220,"minChars":80},"vibeSummary":{"maxChars":150,"minChars":45},"whyWatch":{"maxChars":180,"minChars":60}},"facts":{"countries":["Hong Kong","Malaysia","Netherlands","South Africa"],"director":"Jackie Chan & Benny Chan","genres":["Action","Adventure","Comedy","Thriller"],"keywords":["africa","airplane","commando","fight","fistfight","secret agent"],"overview":"A group of covert CIA operatives trailing a potential new energy source are double-crossed by corrupt agent Morgan, who causes a helicopter crash in remote South Africa. The sole survivor, suffering severe amnesia, is nursed to recovery by a kindly native tribe who call him \"Whoami\" after the question he keeps asking. With the help of a mysterious reporter Christine, Whoami pieces together his past and tracks the turncoat agent and his criminal cohorts.","posterPath":"/9YDKLbBmWGpxG5bO3TBawtNNOAr.jpg","runtimeMinutes":120,"spokenLanguages":["Cantonese","Dutch","English"],"title":"Who Am I?","year":1998},"sourcePacketHash":"sha256:a603d8e5223987e4a17b1d5dda6d3ff52586e3b5a61a64e61e82efed6e0efc6b","spoilerBoundaryRules":{"allowed":["characters or central subjects","starting situation","premise","initial conflict","tone","texture","viewing experience"],"excluded":["major reversals","hidden identities","later deaths","culprit information","late relationship outcomes","third-act events","endings","later revelations"]},"visibleEditorialCopy":{"curiosityHook":"With no memory of his real past, can the stranded agent untangle his identity before the conspirators who betrayed him close in?","description":"After a corrupt CIA agent causes a devastating helicopter crash in South Africa, an amnesiac commando is nursed by a local tribe and must piece together his forgotten identity alongside an enigmatic reporter.","vibeSummary":"Fast, exciting, and lightly comic, delivering brisk action-adventure thrills with an engaging mystery.","whyWatch":"Directed by Jackie Chan and Benny Chan, this fast-paced action-comedy combines globe-trotting intrigue and physical stunts with lighthearted suspense that keeps you engaged."}},"blindPacketSha256":"sha256:09baa92a127c8991a0d860b31bf01374f825debdd73bae81e7344d9fed9c91e0","candidateId":"scale500-tmdb-8697","claudeAdvisory":{"advisoryOnly":true,"affectedFields":["curiosityHook","whyWatch"],"claimSpan":"before the conspirators who betrayed him close in","confidence":"MEDIUM","issueSummaries":["curiosityHook frames the plot as a race in which the betrayers are closing in on the hero ('before the conspirators who betrayed him close in'). The overview says the opposite: Whoami, with Christine's help, pieces together his past and tracks the turncoat agent and his cohorts. The hunter and hunted roles are reversed, and a pursuit-against-a-deadline mechanic is added that the packet does not state. This is an unsupported causal and mechanistic inference.","whyWatch calls the film 'globe-trotting intrigue'. The overview places the story in remote South Africa and names no other location. 'Globe-trotting' implies multiple countries, which is an unsupported setting escalation. The production countries in facts.countries are not evidence of story locations."],"preliminaryDecision":"REVISE","preliminarySeverity":"MINOR","sourceBoundaryReason":"Most of the copy is grounded or is tolerated figurative language and genre shorthand under A_PRIME_PRODUCTION_MATERIALITY_V1. Two concrete unsupported additions remain. The curiosityHook reverses the stated hunter/hunted dynamic and adds a pursuit deadline, which falsely specifies plot mechanics and causality. The whyWatch phrase 'globe-trotting' escalates the story's setting beyond remote South Africa, which is a location and quantity concretization. Neither contradicts the core premise, reveals an outcome or ending, or invents identities, so the severity is MINOR and not SEVERE. A bounded fix would say 'can the amnesiac survivor piece together his past and track down the agent who betrayed him?' and replace 'globe-trotting' with 'remote-wilderness'.","sourceEvidence":[{"notes":"curiosityHook: nothing in the overview says the conspirators pursue or threaten Whoami. The overview says he 'tracks the turncoat agent and his criminal cohorts'. The copy inverts the direction of the chase and adds a ticking-clock element. 'Stranded agent' is tolerated shorthand for the sole survivor of a crash in remote South Africa. 'With no memory of his real past' restates the severe amnesia, and 'real' is a mild flourish.","source":"facts.overview","supportFound":false},{"notes":"whyWatch: 'globe-trotting' has no support. The overview mentions only remote South Africa. The CIA setup and the crash location do not establish travel across the globe.","source":"facts.overview","supportFound":false},{"notes":"description: the corrupt CIA agent causing a helicopter crash in South Africa, the amnesiac survivor nursed by a tribe, piecing together his forgotten past, and the mysterious reporter all restate the overview. 'Local' paraphrases 'native', 'enigmatic' paraphrases 'mysterious', and 'devastating' intensifies the crash. 'Forgotten identity' is a light gloss on 'pieces together his past'. 'Commando' appears only in facts.keywords, while the overview says 'covert CIA operatives'. I treated it as tolerated genre shorthand and mention it under uncertaintyNotes.","source":"facts.overview","supportFound":true},{"notes":"whyWatch and vibeSummary: 'action-comedy', 'action-adventure', 'physical stunts' and 'lighthearted suspense' are consistent with genres Action/Adventure/Comedy/Thriller. 'Jackie Chan and Benny Chan' matches director. 'Intrigue' follows from the double-cross and conspiracy premise.","source":"facts.genres","supportFound":true},{"notes":"acceptedSemanticClassification: 'Fast', 'fast-paced' and 'brisk' match pace=fast. 'Exciting' and 'lightly comic' match moods funny/exciting. 'Engaging mystery' and 'engaged' match attentionDemand=engaged and the amnesia premise. Keyword-only material (airplane, fistfight, secret agent) is not imported.","source":"other","supportFound":true}],"uncertaintyNotes":"This is a near-threshold call. 'Before the conspirators close in' could be read as generic thriller urgency, and 'globe-trotting' as loose adventure shorthand, so an adjudicator could approve either. I flag them because the hook contradicts the direction of the chase stated in the overview, and 'globe-trotting' implies a scope the packet does not establish. 'Commando' (from facts.keywords) for 'covert CIA operatives' was considered and left within tolerance as genre shorthand, though a stricter closed-world reading could ask for 'operative'. 'Untangle his identity' and 'stranded' were also left within tolerance."},"claudeAdvisoryEnvelopeSha256":"sha256:d62563d2f98983875d0cf2d56a613fdc5360f613d0912a8d333429e11d0be685","geminiAdvisory":{"advisoryOnly":true,"affectedFields":[],"claimSpan":"","confidence":"HIGH","issueSummaries":[],"preliminaryDecision":"APPROVE","preliminarySeverity":null,"sourceBoundaryReason":"All visible editorial copy strictly complies with A_PRIME_PRODUCTION_MATERIALITY_V1. The narrative premise, character identity dilemma, and central conflict in the description and curiosityHook adhere faithfully to the authorized overview and verified keywords without leaking third-act plot resolutions, character reveals, or external franchise lore. Tonal descriptors such as 'globe-trotting intrigue' and 'physical stunts' operate as legitimate, low-risk genre shorthand reflecting the verified multi-country production background, action/thriller genres, and commando/fight keywords.","sourceEvidence":[{"notes":"Directly supports the central premise: a covert operative betrayed in a helicopter crash in South Africa, suffering severe amnesia, nursed by a local tribe, and teaming up with a mysterious reporter to uncover his identity and track down the conspirators.","source":"facts.overview","supportFound":true},{"notes":"Directly verifies Action, Adventure, Comedy, and Thriller genres, supporting the 'action-comedy' and 'action-adventure thrills' framing across visible copy.","source":"facts.genres","supportFound":true},{"notes":"facts.director verifies Jackie Chan & Benny Chan. facts.keywords verifies 'commando' and 'fistfight'. Accepted semantic classification directly grounds pace: fast ('Fast', 'fast-paced', 'brisk'), emotionalWeight: light ('lightly comic', 'lighthearted suspense'), moods: [funny, exciting, suspenseful] ('exciting', 'comic', 'suspense'), and attentionDemand: engaged ('engaging', 'keeps you engaged').","source":"other","supportFound":true}],"uncertaintyNotes":null},"geminiAdvisoryEnvelopeSha256":"sha256:075823e0b1f73c17e2c24af60b0a1fcde710937c51335639757c8b085786215e","materialityPolicySha256":"sha256:21661892df4d1b009341b6d34de3bf5ad1ae17e3447abbdace15e1c31a5b843c","schemaVersion":"human-review-bundle.v1","status":"READY_FOR_HUMAN_ADJUDICATION","validationStatus":{"claudeValidated":true,"geminiValidated":true,"packetHashMatched":true}}
