{"$schema":"https://json-schema.org/draft/2020-12/schema","blindPacket":{"acceptedSemanticClassification":{"attentionDemand":"easy","discoveryStyle":"familiar","emotionalWeight":"light","filterLanguages":["English"],"moods":["funny","suspenseful"],"pace":"medium","situations":["family","easy-watch"]},"allowedSourceMaterial":{"keywords":[],"overview":"Scooby-Doo and his pals win an all-expense paid vacation and embark on a trip of a lifetime to a tropical paradise. Their destination however, turns out to be Zombie Island. As soon as they arrive, they realize the place looks strangely familiar and is reminiscent of a trip they took years ago, in which they became wrapped up in a mystery involving zombies. The gang soon learns that their trip to paradise comes with a price when the zombies re-emerge and attack their hotel. Will Scooby-Doo and the Mystery Inc. gang finally solve the mystery behind Zombie Island?"},"candidateId":"scale500-tmdb-615774","copyConstraints":{"curiosityHook":{"maxChars":170,"minChars":50},"description":{"maxChars":220,"minChars":80},"vibeSummary":{"maxChars":150,"minChars":45},"whyWatch":{"maxChars":180,"minChars":60}},"facts":{"countries":["United States of America"],"director":"Cecilia Aranovich & Ethan Spaulding","genres":["Adventure","Animation","Comedy","Family","Fantasy","Horror","Mystery"],"keywords":["cartoon","cartoon dog","talking dog","zombie"],"overview":"Scooby-Doo and his pals win an all-expense paid vacation and embark on a trip of a lifetime to a tropical paradise. Their destination however, turns out to be Zombie Island. As soon as they arrive, they realize the place looks strangely familiar and is reminiscent of a trip they took years ago, in which they became wrapped up in a mystery involving zombies. The gang soon learns that their trip to paradise comes with a price when the zombies re-emerge and attack their hotel. Will Scooby-Doo and the Mystery Inc. gang finally solve the mystery behind Zombie Island?","posterPath":"/vd0oIoWhEm8o7EpS0kV7RaV0Flf.jpg","runtimeMinutes":80,"spokenLanguages":["English"],"title":"Scooby-Doo! Return to Zombie Island","year":2019},"sourcePacketHash":"sha256:3b3987145f73fb146770bded7e198728578d74bfa8f8c0dca4662e9406e607d2","spoilerBoundaryRules":{"allowed":["characters or central subjects","starting situation","premise","initial conflict","tone","texture","viewing experience"],"excluded":["major reversals","hidden identities","later deaths","culprit information","late relationship outcomes","third-act events","endings","later revelations"]},"visibleEditorialCopy":{"curiosityHook":"What connects this seemingly random prize getaway to the gang's prior brush with the undead?","description":"After winning an all-expense-paid tropical vacation, Scooby-Doo and the Mystery Inc. gang arrive at a resort that looks disturbingly familiar. When zombies storm their hotel, an old nightmare resurfaces.","vibeSummary":"Lighthearted, mildly spooky, and fast-moving, it offers an easygoing animated watch built for family night.","whyWatch":"Clocking in at a breezy 80 minutes, it mixes playful comedy with lively cartoon suspense, delivering a comfortable, retro mystery tailored for low-stress family viewing."}},"blindPacketSha256":"sha256:15ffe9a5f59f006536a38da9422466e01b0e98a761481d4725159ba3bf0830b1","candidateId":"scale500-tmdb-615774","claudeAdvisory":{"advisoryOnly":true,"affectedFields":[],"claimSpan":"","confidence":"HIGH","issueSummaries":[],"preliminaryDecision":"APPROVE","preliminarySeverity":null,"sourceBoundaryReason":"Every concrete claim (the all-expense-paid vacation, Scooby-Doo and the Mystery Inc. gang, the familiar-looking destination, the earlier zombie trip, zombies attacking the hotel, runtime, genres) is grounded in the authorized overview. The remaining language ('resort', 'disturbingly familiar', 'old nightmare resurfaces', 'storm', 'retro mystery', 'comfortable') is figurative language, genre shorthand or minor contextual concretization. None of it works as a meaningful new factual claim about plot mechanics, identities, relationships, motives or causality under A_PRIME_PRODUCTION_MATERIALITY_V1. The copy stays at the premise and initial conflict, poses the connection as an open question, and states no resolution, culprit or ending, so no spoiler-boundary content appears.","sourceEvidence":[{"notes":"description: the all-expense-paid tropical vacation, Scooby-Doo and the Mystery Inc. gang, the familiar-looking destination, and zombies attacking their hotel all restate the overview. 'Resort' loosely concretizes 'tropical paradise' and 'hotel'. 'Disturbingly familiar' intensifies 'strangely familiar'. 'An old nightmare resurfaces' is a figurative gloss on 'reminiscent of a trip they took years ago... a mystery involving zombies' and 'the zombies re-emerge'. 'Storm their hotel' intensifies 'attack their hotel'.","source":"facts.overview","supportFound":true},{"notes":"curiosityHook: 'prize getaway' restates the all-expense-paid vacation win. 'The gang's prior brush with the undead' restates the earlier trip involving zombies. 'What connects...' echoes the overview's closing question about solving the mystery behind Zombie Island. 'Seemingly random' is mild framing. The interrogative asserts no answer and states no outcome.","source":"facts.overview","supportFound":true},{"notes":"whyWatch and vibeSummary: 'playful comedy', 'cartoon suspense', 'mildly spooky', 'animated' and 'mystery' are consistent with genres Adventure/Animation/Comedy/Family/Fantasy/Horror/Mystery. '80 minutes' matches runtimeMinutes. 'Retro mystery' is loose tonal shorthand. It leans on the franchise's implied classic-mystery identity, which the packet gestures at through 'Mystery Inc.' and the earlier trip, and it makes no factual claim about franchise history.","source":"facts.genres","supportFound":true},{"notes":"acceptedSemanticClassification: 'Lighthearted' matches emotionalWeight=light and mood funny. 'Mildly spooky' and 'suspense' match mood suspenseful. 'Fast-moving' is slightly off pace=medium and is tonal only. 'Easygoing', 'low-stress' and 'family night' match attentionDemand=easy and situations=[family, easy-watch]. Keyword-only material (cartoon dog, talking dog) is not imported.","source":"other","supportFound":true}],"uncertaintyNotes":"Three small items sit near the tolerance line. 'Resort' is a mild concretization of the destination, which the overview describes as a tropical paradise with a hotel. 'Retro' carries a hint of franchise history that the packet does not state. 'Fast-moving' in vibeSummary sits slightly against the accepted pace of medium. None names a new event, identity or outcome, so I kept all three within tolerance. The curiosityHook's 'what connects' implies that a hidden link exists, which is consistent with the overview's own question about the mystery behind Zombie Island."},"claudeAdvisoryEnvelopeSha256":"sha256:96e94df60f271b4fa443602b58cc517728a5bb51ddc8b17b0220f20d34534a47","geminiAdvisory":{"advisoryOnly":true,"affectedFields":["vibeSummary"],"claimSpan":"fast-moving","confidence":"HIGH","issueSummaries":["The vibeSummary characterizes the film as 'fast-moving', which overstates the narrative tempo and conflicts with the authorized classification of pace: 'medium'."],"preliminaryDecision":"REVISE","preliminarySeverity":"MINOR","sourceBoundaryReason":"Under closed-world source authority and A_PRIME_PRODUCTION_MATERIALITY_V1, experiential descriptors in visible copy must remain accurately calibrated to the authorized acceptedSemanticClassification. Characterizing the film as 'fast-moving' in vibeSummary overstates narrative tempo against the classified pace of 'medium', introducing an unsupported pace escalation on a decision-relevant viewer expectation axis. Because this is a localized, easily fixable phrasing issue that does not distort plot mechanics, character identity, or spoiler boundaries, it represents a MINOR defect requiring revision.","sourceEvidence":[{"notes":"acceptedSemanticClassification explicitly classifies pace as 'medium'. Describing the film as 'fast-moving' in vibeSummary escalates the narrative tempo toward 'fast', misrepresenting a primary decision-relevant experiential axis.","source":"other","supportFound":false},{"notes":"Directly supports Scooby-Doo and the gang winning an all-expense-paid tropical vacation, arriving at an island resort reminiscent of their prior zombie encounter, and zombies re-emerging to attack their hotel.","source":"facts.overview","supportFound":true},{"notes":"Directly verifies Animation, Comedy, Family, Horror, and Mystery genres reflected across description, whyWatch, and vibeSummary.","source":"facts.genres","supportFound":true}],"uncertaintyNotes":"The description and curiosityHook faithfully track the authorized overview and avoid the external franchise-lore leakage ('unmasking countless con artists') that affected the 1998 predecessor entry, properly grounding the 'prior brush with the undead' in the authorized synopsis. In whyWatch, 'breezy 80 minutes' functions as an acceptable description of a short runtime and easy attention demand, but 'fast-moving' in vibeSummary directly asserts an unsupported fast pace."},"geminiAdvisoryEnvelopeSha256":"sha256:064c0fa04dd43286d8713d85d82af2eb0927d4a53714615504f14ebd2adabf41","materialityPolicySha256":"sha256:21661892df4d1b009341b6d34de3bf5ad1ae17e3447abbdace15e1c31a5b843c","schemaVersion":"human-review-bundle.v1","status":"READY_FOR_HUMAN_ADJUDICATION","validationStatus":{"claudeValidated":true,"geminiValidated":true,"packetHashMatched":true}}
