{"$schema":"https://json-schema.org/draft/2020-12/schema","blindPacket":{"acceptedSemanticClassification":{"attentionDemand":"engaged","discoveryStyle":"different","emotionalWeight":"heavy","filterLanguages":["English","Italian","Spanish"],"moods":["suspenseful"],"pace":"medium","situations":["alone"]},"allowedSourceMaterial":{"keywords":[],"overview":"A New York University professor returns from a rescue mission to the Amazon rainforest with the footage shot by a lost team of documentarians who were making a film about the area's local cannibal tribes."},"candidateId":"scale500-tmdb-8689","copyConstraints":{"curiosityHook":{"maxChars":170,"minChars":50},"description":{"maxChars":220,"minChars":80},"vibeSummary":{"maxChars":150,"minChars":45},"whyWatch":{"maxChars":180,"minChars":60}},"facts":{"countries":["Colombia","Italy"],"director":"Ruggero Deodato","genres":["Horror"],"keywords":["abused woman","adulterous wife","adultery","amazon rainforest","amazon tribe","animal attack","animal cruelty","antagonistic","b-horror","banned film","brutality","cannibal","cannibalism","controversy","culture clash","disemboweling","disgusted","film censorship","film in film","film industry","film reel","film within a film","filmmaking","found footage","found footage adjacent","guerilla filmmaking","hatchet","human sacrifice","jungle","leech","lost footage","misogyny","missing person","movie business","pig","pseudo-documentary","rape","rape and murder","ritual","ritual sacrifice","snake","south america","spider","swamp","tortoise","torture","tribe","video nasty","vomit","vomiting woman","yacomo"],"overview":"A New York University professor returns from a rescue mission to the Amazon rainforest with the footage shot by a lost team of documentarians who were making a film about the area's local cannibal tribes.","posterPath":"/otxZzMh53TsN7yYFqSZ3rwH1yMd.jpg","runtimeMinutes":96,"spokenLanguages":["English","Italian","Spanish"],"title":"Cannibal Holocaust","year":1980},"sourcePacketHash":"sha256:ddb376e856d57008cc8b85004b162a54de81926a1a251986031a4a09fecc0913","spoilerBoundaryRules":{"allowed":["characters or central subjects","starting situation","premise","initial conflict","tone","texture","viewing experience"],"excluded":["major reversals","hidden identities","later deaths","culprit information","late relationship outcomes","third-act events","endings","later revelations"]},"visibleEditorialCopy":{"curiosityHook":"A rescue team retrieved the reels left behind by a vanished film crew, but what reality did their cameras capture deep in the rainforest?","description":"After a rescue mission in the Amazon rainforest, a New York University professor returns carrying reels shot by a vanished documentary crew that set out to film local cannibal tribes.","vibeSummary":"Heavy, suspenseful horror marked by grim dread and steady tension, best suited for focused solitary viewing.","whyWatch":"Ruggero Deodato constructs a grim, suspenseful horror investigation centered on recovered footage, examining mortal danger and remote peril with unrelenting tension."}},"blindPacketSha256":"sha256:ffd400cfa4a1e5cb5334e54f187e27907c4d1bb471df00e16d60bfeb9911d51e","candidateId":"scale500-tmdb-8689","claudeAdvisory":{"advisoryOnly":true,"affectedFields":[],"claimSpan":"","confidence":"HIGH","issueSummaries":[],"preliminaryDecision":"APPROVE","preliminarySeverity":null,"sourceBoundaryReason":"All four fields restate or lightly rephrase the authorized overview, facts.director, facts.genres, and the accepted semantic classification. Atmospheric phrases such as 'grim dread', 'mortal danger and remote peril', and 'unrelenting tension' are low-risk figurative/genre shorthand under A_PRIME_PRODUCTION_MATERIALITY_V1 and do not function as new factual claims about plot mechanics, identity, causality, or outcomes. Critically, the copy avoids asserting what happened to the vanished crew (e.g., that they were killed, or by whom), respecting the spoiler boundary against culprit information and later revelations despite the loaded genre context.","sourceEvidence":[{"notes":"description closely tracks the overview: a professor returns from a rescue mission in the Amazon with footage shot by a vanished/lost documentary crew who set out to film local cannibal tribes. No plot mechanics, outcomes, or spoiler-boundary details are added.","source":"allowedSourceMaterial.overview","supportFound":true},{"notes":"curiosityHook's framing (reels retrieved from a vanished film crew, question about what the cameras captured) is a non-committal rhetorical hook that stays within the premise/initial-conflict scope and does not reveal any later plot outcome, culprit information, or ending.","source":"allowedSourceMaterial.overview","supportFound":true},{"notes":"whyWatch correctly attributes direction to Ruggero Deodato (facts.director) and frames the film as horror (facts.genres), consistent with the authorized facts.","source":"facts","supportFound":true},{"notes":"vibeSummary's 'heavy, suspenseful... best suited for focused solitary viewing' directly reflects the authorized emotionalWeight (heavy), moods (suspenseful), and situations (alone) classifications; 'grim dread and steady tension' is low-risk atmospheric shorthand consistent with medium pace and horror genre.","source":"acceptedSemanticClassification","supportFound":true}],"uncertaintyNotes":"curiosityHook attributes the footage retrieval to 'a rescue team' rather than specifically to the professor described in the overview ('a...professor returns...with the footage'); the overview is ambiguous as to whether the professor personally recovered the reels or was part of a broader rescue team. This is a low-materiality agency framing rather than a new factual claim about plot, identity, or outcome, so it does not rise to an interventionary issue."},"claudeAdvisoryEnvelopeSha256":"sha256:886c9c41713f6a2e5129ceff6b7364427fc74811fff7b947d6bc110104777aeb","geminiAdvisory":{"advisoryOnly":true,"affectedFields":[],"claimSpan":"","confidence":"HIGH","issueSummaries":[],"preliminaryDecision":"APPROVE","preliminarySeverity":null,"sourceBoundaryReason":"All editorial copy strictly aligns with the authorized overview, director attribution, genre, and semantic classifications without relying on unauthorized keywords or external lore. Descriptive phrasing such as 'reels', 'recovered footage', and 'horror investigation' represents permissible genre shorthand and narrative framing under A_PRIME_PRODUCTION_MATERIALITY_V1, introducing no ungrounded factual claims or spoiler violations.","sourceEvidence":[{"notes":"Directly supports the central premise: an NYU professor returning from an Amazon rainforest rescue mission with footage/reels shot by a lost documentary crew who set out to film local cannibal tribes.","source":"allowedSourceMaterial.overview","supportFound":true},{"notes":"Directly validates Ruggero Deodato as director.","source":"facts.director","supportFound":true},{"notes":"Directly validates the Horror genre designation.","source":"facts.genres","supportFound":true},{"notes":"Directly supports emotional weight ('heavy'), mood ('suspenseful'), pace ('medium' / steady tension), and viewing situation ('alone' / focused solitary viewing).","source":"acceptedSemanticClassification","supportFound":true}],"uncertaintyNotes":null},"geminiAdvisoryEnvelopeSha256":"sha256:8509140ca9d950c146d8d1155a2ace35b5066cac7f3502c177ddfe414a3751f9","materialityPolicySha256":"sha256:21661892df4d1b009341b6d34de3bf5ad1ae17e3447abbdace15e1c31a5b843c","schemaVersion":"human-review-bundle.v1","status":"READY_FOR_HUMAN_ADJUDICATION","validationStatus":{"claudeValidated":true,"geminiValidated":true,"packetHashMatched":true}}
