{"$schema":"https://json-schema.org/draft/2020-12/schema","blindPacket":{"acceptedSemanticClassification":{"attentionDemand":"easy","discoveryStyle":"different","emotionalWeight":"moderate","filterLanguages":["French"],"moods":["exciting"],"pace":"medium","situations":["family","easy-watch"]},"allowedSourceMaterial":{"keywords":[],"overview":"Drawn from elements of West African folk tales, it depicts how a newborn boy, Kirikou, saves his village from the evil witch Karaba."},"candidateId":"scale500-tmdb-21348","copyConstraints":{"curiosityHook":{"maxChars":170,"minChars":50},"description":{"maxChars":220,"minChars":80},"vibeSummary":{"maxChars":150,"minChars":45},"whyWatch":{"maxChars":180,"minChars":60}},"facts":{"countries":["Belgium","France","Luxembourg"],"director":"Michel Ocelot","genres":["Adventure","Animation","Family","Fantasy"],"keywords":["african tale","bad witch","cultures of west africa","folk","folktale","french","power of goodness","supersteiner"],"overview":"Drawn from elements of West African folk tales, it depicts how a newborn boy, Kirikou, saves his village from the evil witch Karaba.","posterPath":"/9RNrozaagFmpm6m0CP7q4XDcIXj.jpg","runtimeMinutes":71,"spokenLanguages":["French"],"title":"Kirikou and the Sorceress","year":1998},"sourcePacketHash":"sha256:3a33d748ac29ab673e2854e6820af7e7719e269b653b6e1284d7ac69a5a03c75","spoilerBoundaryRules":{"allowed":["characters or central subjects","starting situation","premise","initial conflict","tone","texture","viewing experience"],"excluded":["major reversals","hidden identities","later deaths","culprit information","late relationship outcomes","third-act events","endings","later revelations"]},"visibleEditorialCopy":{"curiosityHook":"Can a clever newborn boy uncover a way to outwit a formidable sorceress and rescue his endangered village?","description":"Drawing from West African folk tales, this animated adventure follows Kirikou, a precocious newborn boy who immediately sets out to protect his imperiled village from the powerful sorceress Karaba.","vibeSummary":"Vibrant, brisk, and family-friendly, balancing exciting folk-tale stakes with an accessible 71-minute pace.","whyWatch":"Michel Ocelot crafts a vibrant, concise fantasy adventure that reimagines traditional folklore into a spirited and visually distinctive animated journey."}},"blindPacketSha256":"sha256:f98e4f439eff9fcae962e386c46c821474265c129e009fe7c595f364099f83e1","candidateId":"scale500-tmdb-21348","claudeAdvisory":{"advisoryOnly":true,"affectedFields":[],"claimSpan":"","confidence":"MEDIUM","issueSummaries":[],"preliminaryDecision":"APPROVE","preliminarySeverity":null,"sourceBoundaryReason":"Every concrete claim (the West African folk-tale basis, the newborn Kirikou, the village, the sorceress Karaba, the director, runtime and genres) is grounded in the authorized overview. The remaining language ('precocious', 'immediately sets out', 'clever', 'outwit', 'powerful', 'imperiled') is figurative characterization or minor contextual concretization. None of it works as a meaningful new factual claim about plot mechanics, identities, relationships or causality under A_PRIME_PRODUCTION_MATERIALITY_V1. The copy stays at the premise and initial conflict, and the hook is a question that asserts no outcome, so no spoiler-boundary content appears.","sourceEvidence":[{"notes":"description: the West African folk-tale origin, the newborn boy Kirikou, the village, and the sorceress Karaba all restate the overview. 'Sets out to protect' paraphrases 'saves'. 'Imperiled' is implied by the village needing to be saved. 'Powerful' echoes 'evil' as a characterization flourish. 'Sorceress' for 'witch' is a light terminology variation supported by the title, 'Kirikou and the Sorceress'. 'Michel Ocelot' and 'animated adventure' match director and genres.","source":"facts.overview","supportFound":true},{"notes":"curiosityHook: 'newborn boy', 'formidable sorceress' and 'rescue his endangered village' restate the overview. 'Clever' and 'outwit' characterize how he prevails, and they are discussed under uncertaintyNotes. The interrogative asserts no outcome.","source":"facts.overview","supportFound":true},{"notes":"whyWatch and vibeSummary: 'fantasy adventure', 'animated journey' and 'family-friendly' are consistent with genres Adventure/Animation/Family/Fantasy. '71-minute' matches runtimeMinutes. 'Reimagines traditional folklore' echoes 'drawn from elements of West African folk tales'. 'Visually distinctive', 'vibrant' and 'spirited' are evaluative flourishes.","source":"facts.genres","supportFound":true},{"notes":"acceptedSemanticClassification: 'Exciting' matches mood exciting. 'Accessible' and 'family-friendly' match attentionDemand=easy and situations=[family, easy-watch]. 'Brisk' is slightly off pace=medium and is tonal only. Keyword-only material (supersteiner, power of goodness, bad witch) is not imported.","source":"other","supportFound":true}],"uncertaintyNotes":"Three items sit near the tolerance line. 'Immediately sets out' adds a timing claim the overview does not make. 'Outwit' implies cleverness as the means of prevailing, where the overview says only that he saves the village. 'Precocious' is a characterization that the overview does not state, although it follows naturally from a newborn who saves a village. I read all three as figurative shorthand that names no new event, relationship or outcome. A stricter adjudicator could ask for 'immediately' and 'outwit' to be softened toward 'saves', in which case they would be MINOR timing and mechanism concretizations. 'Brisk' sits slightly against the accepted pace of medium and is tonal only."},"claudeAdvisoryEnvelopeSha256":"sha256:34ef301c5983b8de5895c1f172122bb2fc3b86f656493a1959acc3b1eac26611","geminiAdvisory":{"advisoryOnly":true,"affectedFields":[],"claimSpan":"","confidence":"HIGH","issueSummaries":[],"preliminaryDecision":"APPROVE","preliminarySeverity":null,"sourceBoundaryReason":"All visible editorial copy strictly complies with A_PRIME_PRODUCTION_MATERIALITY_V1. The narrative premise, character dynamic, and folklore foundation in the description and curiosityHook adhere faithfully to the authorized overview, verified keywords, and title without leaking third-act resolution mechanics or origin revelations. Characterizing Kirikou as 'precocious' or 'clever' operates as natural, low-risk editorial inference for an infant capable of immediately protecting his village from an evil witch, while descriptors such as 'vibrant', 'brisk', and 'concise' represent legitimate atmospheric framing well-anchored in the film's lean 71-minute runtime and verified animation/fantasy genres.","sourceEvidence":[{"notes":"Directly supports Kirikou as a newborn boy saving his village from the evil witch Karaba, drawn from elements of West African folk tales.","source":"facts.overview","supportFound":true},{"notes":"Directly confirms Adventure, Animation, Family, and Fantasy genres, supporting 'animated adventure', 'family-friendly', and 'fantasy adventure' across visible copy.","source":"facts.genres","supportFound":true},{"notes":"facts.director verifies Michel Ocelot, facts.title verifies 'the Sorceress', and runtimeMinutes (71) verifies '71-minute'. Accepted semantic classification directly grounds attentionDemand: easy ('accessible', 'easy-watch'), situations: family ('family-friendly'), moods: exciting ('exciting folk-tale stakes'), and pace: medium ('accessible 71-minute pace').","source":"other","supportFound":true}],"uncertaintyNotes":null},"geminiAdvisoryEnvelopeSha256":"sha256:3882ef755a492d38409cd6104870cfd6510e122926f2615d109c0bbb4667f9d0","materialityPolicySha256":"sha256:21661892df4d1b009341b6d34de3bf5ad1ae17e3447abbdace15e1c31a5b843c","schemaVersion":"human-review-bundle.v1","status":"READY_FOR_HUMAN_ADJUDICATION","validationStatus":{"claudeValidated":true,"geminiValidated":true,"packetHashMatched":true}}
