{"$schema":"https://json-schema.org/draft/2020-12/schema","blindPacket":{"acceptedSemanticClassification":{"attentionDemand":"engaged","discoveryStyle":"different","emotionalWeight":"moderate","filterLanguages":["Japanese"],"moods":["exciting","suspenseful"],"pace":"fast","situations":["friends","alone"]},"allowedSourceMaterial":{"keywords":[],"overview":"Jubei is a masterless ninja who travels the land alone, lending his services to those with gold—or a worthy cause. His fearsome abilities have served him well, but a plot to overthrow the government threatens to end his wandering ways—and possibly his life."},"candidateId":"scale500-tmdb-14282","copyConstraints":{"curiosityHook":{"maxChars":170,"minChars":50},"description":{"maxChars":220,"minChars":80},"vibeSummary":{"maxChars":150,"minChars":45},"whyWatch":{"maxChars":180,"minChars":60}},"facts":{"countries":["Japan"],"director":"Yoshiaki Kawajiri","genres":["Action","Animation","Fantasy","Horror"],"keywords":["anime","bondage","cruelty","dark fantasy","demon","female ninja","horror","japan","kunoichi","ninja","rescue","scroll","sexual abuse","tragedy"],"overview":"Jubei is a masterless ninja who travels the land alone, lending his services to those with gold—or a worthy cause. His fearsome abilities have served him well, but a plot to overthrow the government threatens to end his wandering ways—and possibly his life.","posterPath":"/qzZEnaXwv4wss2QalEo4Uf9BAwh.jpg","runtimeMinutes":94,"spokenLanguages":["Japanese"],"title":"Ninja Scroll","year":1993},"sourcePacketHash":"sha256:265dbed66b2d4e91e81848bd6ac209e72de3b6dc8364334854ccbd788af3f0a0","spoilerBoundaryRules":{"allowed":["characters or central subjects","starting situation","premise","initial conflict","tone","texture","viewing experience"],"excluded":["major reversals","hidden identities","later deaths","culprit information","late relationship outcomes","third-act events","endings","later revelations"]},"visibleEditorialCopy":{"curiosityHook":"When a rogue plot threatens the entire government, can a lone swordsman's mercenary code keep him alive against forces bent on total upheaval?","description":"Wandering mercenary ninja Jubei hires out his lethal talents across Japan. But when a violent conspiracy targeting the government crosses his solitary path, his drifting life—and his survival—fall under immediate threat.","vibeSummary":"Fast-paced, suspenseful, and dark. A high-energy animated horror-action hybrid built for focused late-night viewing.","whyWatch":"Directed by Yoshiaki Kawajiri, this 1993 animated action feature fuses dark fantasy and horror into a relentless, kinetic clash powered by mortal danger and stylized combat."}},"blindPacketSha256":"sha256:64a6b35111d52a830aa6118cc6e204608387fbbdf031fd28f9018601ae65bc61","candidateId":"scale500-tmdb-14282","claudeAdvisory":{"advisoryOnly":true,"affectedFields":["curiosityHook"],"claimSpan":"a lone swordsman's mercenary code","confidence":"MEDIUM","issueSummaries":["curiosityHook recasts the protagonist as 'a lone swordsman' with a 'mercenary code'. The packet identifies Jubei as a 'masterless ninja'. Nothing in the packet mentions swords, and the keywords do not either. 'Swordsman' therefore substitutes a different, more specific identity and weapon attribute for 'ninja' (alias/terminology substitution and unsupported factual concretization). 'Mercenary code' also invents a code of conduct. The overview says only that he lends his services 'to those with gold—or a worthy cause', which does not describe a mercenary code and includes a non-mercenary motive. A bounded fix would keep 'ninja' (for example 'a lone, masterless ninja') and drop the 'code'."],"preliminaryDecision":"REVISE","preliminarySeverity":"MINOR","sourceBoundaryReason":"Nearly all of the copy is grounded or is tolerated figurative language and genre shorthand under A_PRIME_PRODUCTION_MATERIALITY_V1 ('violent conspiracy', 'immediate threat', 'total upheaval', 'relentless, kinetic clash', 'stylized combat'). The concrete unsupported addition is in curiosityHook, where 'ninja' becomes 'swordsman' and a 'mercenary code' appears. These specify a character identity and a weapon-based framing that the packet does not authorize, and they narrow a stated motive (gold or a worthy cause) to a purely mercenary one. They do not contradict the plot, invent events or outcomes, or cross the spoiler boundary, and the copy stays at the premise and initial conflict. The severity is therefore MINOR and not SEVERE.","sourceEvidence":[{"notes":"curiosityHook: 'swordsman' has no support. The overview calls Jubei 'a masterless ninja' and names no weapon. 'Mercenary code' is not stated either, since the overview gives his motives as gold or a worthy cause and does not describe any code.","source":"facts.overview","supportFound":false},{"notes":"description: the wandering ninja Jubei, hiring out his abilities, the plot against the government, and the threat to his wandering life and survival all restate the overview. 'Across Japan' paraphrases 'travels the land' and is supported by facts.countries and the 'japan' keyword. 'Lethal talents' paraphrases 'fearsome abilities'. 'Solitary path' echoes 'alone'. 'Violent conspiracy' adds 'violent' to 'plot to overthrow the government', and 'immediate threat' intensifies 'threatens'. Both are tolerated figurative intensification.","source":"facts.overview","supportFound":true},{"notes":"curiosityHook: 'lone', 'plot threatens the entire government', 'keep him alive' and 'total upheaval' restate or intensify the overview's plot to overthrow the government and the risk to his life. 'Rogue plot' and 'forces bent on total upheaval' are figurative. 'Forces' loosely implies multiple agents, but it names no identity. The interrogative asserts no outcome.","source":"facts.overview","supportFound":true},{"notes":"whyWatch and vibeSummary: 'animated', 'action', 'dark fantasy', 'horror' and 'horror-action hybrid' match genres Action/Animation/Fantasy/Horror, and 'dark fantasy' also appears in facts.keywords. 'Yoshiaki Kawajiri' and '1993' match director and year. 'Stylized combat', 'relentless' and 'kinetic' are genre and tonal shorthand.","source":"facts.genres","supportFound":true},{"notes":"acceptedSemanticClassification: 'Fast-paced' matches pace=fast, 'suspenseful' matches moods, and 'focused' viewing matches attentionDemand=engaged. 'Late-night' is not in situations=[friends, alone], but it is a viewing-mood flourish and not a film claim. Keyword-only material (demon, kunoichi, bondage, sexual abuse, scroll) is not imported.","source":"other","supportFound":true}],"uncertaintyNotes":"This is a near-threshold call. 'Swordsman' could be read as generic action-hero shorthand for a ninja, and 'mercenary' loosely describes someone who lends services for gold, so an adjudicator could approve on that basis. I flag it because the packet names 'ninja' explicitly and the closed-world rule treats the added weapon identity as ungrounded. I also considered 'mercenary ninja' in the description, which drops the 'worthy cause' half of the source's motive. I left that within tolerance as shorthand, but a stricter reading would extend the same concern to description. 'Across Japan', 'violent conspiracy' and 'late-night viewing' were considered and left within tolerance."},"claudeAdvisoryEnvelopeSha256":"sha256:4eb44a97a34d5fd25d33ddb2fe76b622e662dfda3d1fba3dd3dc52e548febcd1","geminiAdvisory":{"advisoryOnly":true,"affectedFields":[],"claimSpan":"","confidence":"HIGH","issueSummaries":[],"preliminaryDecision":"APPROVE","preliminarySeverity":null,"sourceBoundaryReason":"All visible editorial copy strictly complies with A_PRIME_PRODUCTION_MATERIALITY_V1. The synopsis and curiosity hook remain cleanly tethered to the authorized starting premise without introducing ungrounded plot specifics (such as the Eight Devils of Kimon, Kagero, or poison mechanics), external franchise lore, or third-act spoiler revelations. Phrasing such as 'mercenary ninja', 'lone swordsman's mercenary code', and 'forces bent on total upheaval' functions as legitimate, low-risk genre shorthand and thematic paraphrase reflecting the authorized masterless mercenary and government overthrow premise.","sourceEvidence":[{"notes":"Directly supports Jubei as a wandering masterless ninja lending his services for gold or a worthy cause, whose solitary life and survival are threatened by a plot to overthrow the government.","source":"facts.overview","supportFound":true},{"notes":"Directly confirms Action, Animation, Fantasy, and Horror genres, supporting the animated action feature, dark fantasy, and horror descriptors in whyWatch and vibeSummary.","source":"facts.genres","supportFound":true},{"notes":"facts.director verifies Yoshiaki Kawajiri and facts.year verifies 1993. Accepted semantic classification directly supports pace: fast ('Fast-paced', 'relentless, kinetic'), moods: [exciting, suspenseful] ('suspenseful', 'high-energy'), attentionDemand: engaged ('focused'), and situations: alone ('focused late-night viewing').","source":"other","supportFound":true}],"uncertaintyNotes":null},"geminiAdvisoryEnvelopeSha256":"sha256:f08252c73a6170702f4d54aeeb40712b558cd9a470e49ecd5e5d1da62b85e3fe","materialityPolicySha256":"sha256:21661892df4d1b009341b6d34de3bf5ad1ae17e3447abbdace15e1c31a5b843c","schemaVersion":"human-review-bundle.v1","status":"READY_FOR_HUMAN_ADJUDICATION","validationStatus":{"claudeValidated":true,"geminiValidated":true,"packetHashMatched":true}}
